Timestamp,Name,Website,Description,Facebook,Twitter,Categories,Phone,Email,Others
3/31/2021 19:48:22,Dr. Sasa,https://www.facebook.com/DrSasa22222,UN Special Envoy,https://www.facebook.com/DrSasa22222/,https://twitter.com/DrSasa22222,Personal,,specialenvoytoun@crphmyanmar.org,
3/31/2021 20:12:43,Justice For Myanmar,https://www.justiceformyanmar.org/,Justice For Myanmar,https://www.facebook.com/justiceformyanmar.org,https://twitter.com/JusticeMyanmar,"NGO, Whistleblower",,media@justiceformyanmar.org,
3/31/2021 20:49:56,Three Fingers,https://www.threefingers.org/,Three Fingers Art Website,https://www.facebook.com/Raise3Fingers,https://twitter.com/Raise3Fingers,Art,,contact@threefingers.org,
3/31/2021 20:51:39,Committee Representing Pyidaungsu Hluttaw (CRPH),https://crphmyanmar.org/,Committee Representing Pyidaungsu Hluttaw (CRPH),https://www.facebook.com/crph.ir.office,https://twitter.com/CrphMyanmar,"Government, NLD, CRPH",,office@crphmyanmar.org,
3/31/2021 20:52:38,Htin Linn Aung,https://www.facebook.com/crph.ir.office,International Relations Office,https://www.facebook.com/crph.ir.office,,"Government, NLD, CRPH",,internationalrelations@crphmyanmar.org,
3/31/2021 21:03:53,Anonymous,https://t.co/KWXal7qusT?amp=1,Anonymous Exposing Human Rights abuses from around the world.,https://www.facebook.com/YourAnonymousCentral/,https://twitter.com/YourAnonCentral,NGO,,,
3/31/2021 21:11:03,Social Punishment dot Com,https://www.socialpunishment.com/,https://www.socialpunishment.com/,,,"Social Punishment, SP",,,
3/31/2021 21:17:15,Anonymous Evidences of Repression,https://myanmararmybrutality.github.io/archive/index.html,Myanmar military junta repression evidences,https://www.facebook.com/YourAnonymousCentral/,https://twitter.com/YourAnonCentral,"NGO, YAC, Anonymous",,,
3/31/2021 21:24:05,Links collections for helping Myanmar,https://linktr.ee/meemalee,Collections of petition links,,,"Petition, Links, Support Myanmar",,,